2024-11-07 16:42:55.334462 IP 10.32.43.124 > 1.1.1.1: ICMP echo request, id 59985, seq 0, length 24
2024-11-07 16:42:55.337643 IP 1.1.1.1 > 10.32.43.124: ICMP echo reply, id 59985, seq 0, length 24
2024-11-07 16:42:56.126509 IP 10.32.43.124.58828 > 140.82.112.25.443: Flags [.], ack 1030676969, win 2048, length 0
2024-11-07 16:42:56.219750 IP 140.82.112.25.443 > 10.32.43.124.58828: Flags [.], ack 1, win 76, options [nop,nop,TS val 3867695879 ecr 3899627839], length 0
2024-11-07 16:42:56.334840 IP 10.32.43.124 > 1.1.1.1: ICMP echo request, id 59985, seq 0, length 24
2024-11-07 16:42:56.337958 IP 1.1.1.1 > 10.32.43.124: ICMP echo reply, id 59985, seq 0, length 24


