2024-11-07 16:42:55.085281 STP 802.1w, Rapid STP, Flags [Learn, Forward, Agreement], bridge-id 8000.68:d7:9a:4b:a7:68.8002, length 36
2024-11-07 16:42:55.334462 IP 10.32.43.124 > 1.1.1.1: ICMP echo request, id 59985, seq 0, length 24
2024-11-07 16:42:55.337643 IP 1.1.1.1 > 10.32.43.124: ICMP echo reply, id 59985, seq 0, length 24
2024-11-07 16:42:56.126509 IP 10.32.43.124.58828 > 140.82.112.25.443: Flags [.], ack 1030676969, win 2048, length 0
2024-11-07 16:42:56.219750 IP 140.82.112.25.443 > 10.32.43.124.58828: Flags [.], ack 1, win 76, options [nop,nop,TS val 3867695879 ecr 3899627839], length 0
2024-11-07 16:42:56.334840 IP 10.32.43.124 > 1.1.1.1: ICMP echo request, id 59985, seq 0, length 24
2024-11-07 16:42:56.337958 IP 1.1.1.1 > 10.32.43.124: ICMP echo reply, id 59985, seq 0, length 24
2024-11-07 16:42:56.520815 IP 10.32.43.124.58932 > 172.65.251.78.443: Flags [P.], seq 1711661902:1711662452, ack 3835356672, win 4542, options [nop,nop,TS val 950037546 ecr 4236746022], length 550
2024-11-07 16:42:56.520855 IP 10.32.43.124.58932 > 172.65.251.78.443: Flags [P.], seq 550:589, ack 1, win 4542, options [nop,nop,TS val 950037546 ecr 4236746022], length 39
2024-11-07 16:42:56.547937 IP 172.65.251.78.443 > 10.32.43.124.58932: Flags [.], ack 550, win 9, options [nop,nop,TS val 4236801644 ecr 950037546], length 0
2024-11-07 16:42:56.549701 IP 172.65.251.78.443 > 10.32.43.124.58932: Flags [.], ack 589, win 9, options [nop,nop,TS val 4236801670 ecr 950037546], length 0
2024-11-07 16:42:56.549702 IP 172.65.251.78.443 > 10.32.43.124.58932: Flags [P.], seq 1:40, ack 589, win 9, options [nop,nop,TS val 4236801670 ecr 950037546], length 39
2024-11-07 16:42:56.549767 IP 10.32.43.124.58932 > 172.65.251.78.443: Flags [.], ack 40, win 4541, options [nop,nop,TS val 950037575 ecr 4236801670], length 0
2024-11-07 16:42:56.777992 IP 10.32.43.124.58958 > 195.88.54.98.443: Flags [P.], seq 2507396556:2507396637, ack 2735795760, win 2048, options [nop,nop,TS val 1240217949 ecr 122347049], length 81
2024-11-07 16:42:56.780754 IP 195.88.54.98.443 > 10.32.43.124.58958: Flags [.], ack 81, win 55, options [nop,nop,TS val 122356510 ecr 1240217949], length 0
2024-11-07 16:42:56.781040 IP 195.88.54.98.443 > 10.32.43.124.58958: Flags [P.], seq 1:82, ack 81, win 55, options [nop,nop,TS val 122356511 ecr 1240217949], length 81
2024-11-07 16:42:56.781106 IP 10.32.43.124.58958 > 195.88.54.98.443: Flags [.], ack 82, win 2046, options [nop,nop,TS val 1240217952 ecr 122356511], length 0
2024-11-07 16:42:57.085416 STP 802.1w, Rapid STP, Flags [Learn, Forward, Agreement], bridge-id 8000.68:d7:9a:4b:a7:68.8002, length 36
2024-11-07 16:42:57.335866 IP 10.32.43.124 > 1.1.1.1: ICMP echo request, id 59985, seq 0, length 24
2024-11-07 16:42:57.339256 IP 1.1.1.1 > 10.32.43.124: ICMP echo reply, id 59985, seq 0, length 24
2024-11-07 16:42:57.634935 IP 172.65.251.78.443 > 10.32.43.124.58932: Flags [.], seq 40:1488, ack 589, win 9, options [nop,nop,TS val 4236802755 ecr 950037575], length 1448
2024-11-07 16:42:57.634937 IP 172.65.251.78.443 > 10.32.43.124.58932: Flags [P.], seq 1488:1995, ack 589, win 9, options [nop,nop,TS val 4236802755 ecr 950037575], length 507
2024-11-07 16:42:57.635098 IP 10.32.43.124.58932 > 172.65.251.78.443: Flags [.], ack 1995, win 4511, options [nop,nop,TS val 950038660 ecr 4236802755], length 0
2024-11-07 16:42:57.762667 IP 172.65.251.78.443 > 10.32.43.124.58932: Flags [.], seq 1995:3443, ack 589, win 9, options [nop,nop,TS val 4236802883 ecr 950038660], length 1448
2024-11-07 16:42:57.762670 IP 172.65.251.78.443 > 10.32.43.124.58932: Flags [.], seq 3443:4891, ack 589, win 9, options [nop,nop,TS val 4236802883 ecr 950038660], length 1448
2024-11-07 16:42:57.762671 IP 172.65.251.78.443 > 10.32.43.124.58932: Flags [.], seq 4891:6339, ack 589, win 9, options [nop,nop,TS val 4236802883 ecr 950038660], length 1448
2024-11-07 16:42:57.762672 IP 172.65.251.78.443 > 10.32.43.124.58932: Flags [.], seq 6339:7787, ack 589, win 9, options [nop,nop,TS val 4236802883 ecr 950038660], length 1448
2024-11-07 16:42:57.762674 IP 172.65.251.78.443 > 10.32.43.124.58932: Flags [.], seq 7787:9235, ack 589, win 9, options [nop,nop,TS val 4236802883 ecr 950038660], length 1448
2024-11-07 16:42:57.762675 IP 172.65.251.78.443 > 10.32.43.124.58932: Flags [.], seq 9235:10683, ack 589, win 9, options [nop,nop,TS val 4236802883 ecr 950038660], length 1448
2024-11-07 16:42:57.762677 IP 172.65.251.78.443 > 10.32.43.124.58932: Flags [.], seq 10683:12131, ack 589, win 9, options [nop,nop,TS val 4236802883 ecr 950038660], length 1448
2024-11-07 16:42:57.762678 IP 172.65.251.78.443 > 10.32.43.124.58932: Flags [.], seq 12131:13579, ack 589, win 9, options [nop,nop,TS val 4236802883 ecr 950038660], length 1448
2024-11-07 16:42:57.762679 IP 172.65.251.78.443 > 10.32.43.124.58932: Flags [.], seq 13579:15027, ack 589, win 9, options [nop,nop,TS val 4236802883 ecr 950038660], length 1448
2024-11-07 16:42:57.762796 IP 172.65.251.78.443 > 10.32.43.124.58932: Flags [P.], seq 15027:16418, ack 589, win 9, options [nop,nop,TS val 4236802883 ecr 950038660], length 1391
2024-11-07 16:42:57.762851 IP 10.32.43.124.58932 > 172.65.251.78.443: Flags [.], ack 15027, win 4338, options [nop,nop,TS val 950038788 ecr 4236802883], length 0
2024-11-07 16:42:57.762927 IP 10.32.43.124.58932 > 172.65.251.78.443: Flags [.], ack 16418, win 4316, options [nop,nop,TS val 950038788 ecr 4236802883], length 0
2024-11-07 16:42:57.763010 IP 10.32.43.124.58932 > 172.65.251.78.443: Flags [.], ack 16418, win 4542, options [nop,nop,TS val 950038788 ecr 4236802883], length 0
2024-11-07 16:42:57.763708 IP 10.32.43.124.58932 > 172.65.251.78.443: Flags [P.], seq 589:624, ack 16418, win 4542, options [nop,nop,TS val 950038788 ecr 4236802883], length 35
2024-11-07 16:42:57.775992 IP 10.32.43.124.58932 > 172.65.251.78.443: Flags [.], seq 624:2012, ack 16418, win 4542, options [nop,nop,TS val 950038801 ecr 4236802883], length 1388
2024-11-07 16:42:57.776015 IP 10.32.43.124.58932 > 172.65.251.78.443: Flags [P.], seq 2012:2522, ack 16418, win 4542, options [nop,nop,TS val 950038801 ecr 4236802883], length 510
2024-11-07 16:42:57.776143 IP 10.32.43.124.58932 > 172.65.251.78.443: Flags [P.], seq 2522:2827, ack 16418, win 4542, options [nop,nop,TS val 950038801 ecr 4236802883], length 305
2024-11-07 16:42:57.778574 IP 172.65.251.78.443 > 10.32.43.124.58932: Flags [.], ack 2827, win 9, options [nop,nop,TS val 4236802899 ecr 950038788], length 0
2024-11-07 16:42:57.978819 IP 10.32.43.124.47819 > 10.32.43.5.53: 25665+ A? github.com. (28)
2024-11-07 16:42:57.978867 IP 10.32.43.124.53075 > 10.32.43.5.53: 18598+ Type65? github.com. (28)
2024-11-07 16:42:57.981568 IP 10.32.43.5.53 > 10.32.43.124.53075: 18598 0/1/0 (93)
2024-11-07 16:42:58.005041 IP 10.32.43.5.53 > 10.32.43.124.47819: 25665 1/0/0 A 140.82.121.3 (44)
2024-11-07 16:42:58.005326 IP 10.32.43.124.59164 > 31.209.137.10.443: Flags [R.], seq 4142893325, ack 2531670540, win 2053, length 0
2024-11-07 16:42:58.005464 IP 10.32.43.124.59181 > 140.82.121.3.443: Flags [S], seq 2017134647, win 65535, options [mss 1460,nop,wscale 6,nop,nop,TS val 3247038338 ecr 0,sackOK,eol], length 0
2024-11-07 16:42:58.031713 IP 140.82.121.3.443 > 10.32.43.124.59181: Flags [S.], seq 921683848, ack 2017134648, win 65535, options [mss 1436,sackOK,TS val 2565261167 ecr 3247038338,nop,wscale 10], length 0
2024-11-07 16:42:58.031801 IP 10.32.43.124.59181 > 140.82.121.3.443: Flags [.], ack 1, win 2069, options [nop,nop,TS val 3247038365 ecr 2565261167], length 0
2024-11-07 16:42:58.032003 IP 10.32.43.124.59181 > 140.82.121.3.443: Flags [.], seq 1:1425, ack 1, win 2069, options [nop,nop,TS val 3247038365 ecr 2565261167], length 1424
2024-11-07 16:42:58.032026 IP 10.32.43.124.59181 > 140.82.121.3.443: Flags [P.], seq 1425:1864, ack 1, win 2069, options [nop,nop,TS val 3247038365 ecr 2565261167], length 439
2024-11-07 16:42:58.061935 IP 140.82.121.3.443 > 10.32.43.124.59181: Flags [.], ack 1864, win 70, options [nop,nop,TS val 2565261197 ecr 3247038365], length 0
2024-11-07 16:42:58.062662 IP 140.82.121.3.443 > 10.32.43.124.59181: Flags [.], seq 1:1425, ack 1864, win 70, options [nop,nop,TS val 2565261197 ecr 3247038365], length 1424
2024-11-07 16:42:58.062715 IP 10.32.43.124.59181 > 140.82.121.3.443: Flags [.], ack 1425, win 2047, options [nop,nop,TS val 3247038395 ecr 2565261197], length 0
2024-11-07 16:42:58.062914 IP 140.82.121.3.443 > 10.32.43.124.59181: Flags [P.], seq 1425:2849, ack 1864, win 70, options [nop,nop,TS val 2565261197 ecr 3247038365], length 1424
2024-11-07 16:42:58.062915 IP 140.82.121.3.443 > 10.32.43.124.59181: Flags [P.], seq 2849:3494, ack 1864, win 70, options [nop,nop,TS val 2565261197 ecr 3247038365], length 645
2024-11-07 16:42:58.062937 IP 10.32.43.124.59181 > 140.82.121.3.443: Flags [.], ack 3494, win 2015, options [nop,nop,TS val 3247038395 ecr 2565261197], length 0
2024-11-07 16:42:58.063183 IP 10.32.43.124.59181 > 140.82.121.3.443: Flags [P.], seq 1864:1928, ack 3494, win 2048, options [nop,nop,TS val 3247038396 ecr 2565261197], length 64
2024-11-07 16:42:58.063263 IP 10.32.43.124.59181 > 140.82.121.3.443: Flags [P.], seq 1928:2020, ack 3494, win 2048, options [nop,nop,TS val 3247038396 ecr 2565261197], length 92
2024-11-07 16:42:58.063358 IP 10.32.43.124.59181 > 140.82.121.3.443: Flags [.], seq 2020:3444, ack 3494, win 2048, options [nop,nop,TS val 3247038396 ecr 2565261197], length 1424
2024-11-07 16:42:58.063364 IP 10.32.43.124.59181 > 140.82.121.3.443: Flags [P.], seq 3444:3905, ack 3494, win 2048, options [nop,nop,TS val 3247038396 ecr 2565261197], length 461
2024-11-07 16:42:58.072276 IP 172.65.251.78.443 > 10.32.43.124.58932: Flags [P.], seq 16418:16948, ack 2827, win 9, options [nop,nop,TS val 4236803193 ecr 950038788], length 530
2024-11-07 16:42:58.072327 IP 10.32.43.124.58932 > 172.65.251.78.443: Flags [.], ack 16948, win 4533, options [nop,nop,TS val 950039097 ecr 4236803193], length 0
2024-11-07 16:42:58.072607 IP 10.32.43.124.58932 > 172.65.251.78.443: Flags [P.], seq 2827:2862, ack 16948, win 4542, options [nop,nop,TS val 950039097 ecr 4236803193], length 35
2024-11-07 16:42:58.083541 IP 10.32.43.124.58932 > 172.65.251.78.443: Flags [.], seq 2862:4250, ack 16948, win 4542, options [nop,nop,TS val 950039109 ecr 4236803193], length 1388
2024-11-07 16:42:58.083558 IP 10.32.43.124.58932 > 172.65.251.78.443: Flags [P.], seq 4250:5166, ack 16948, win 4542, options [nop,nop,TS val 950039109 ecr 4236803193], length 916
2024-11-07 16:42:58.083572 IP 10.32.43.124.58932 > 172.65.251.78.443: Flags [P.], seq 5166:5667, ack 16948, win 4542, options [nop,nop,TS val 950039109 ecr 4236803193], length 501
2024-11-07 16:42:58.086102 IP 172.65.251.78.443 > 10.32.43.124.58932: Flags [.], ack 5667, win 9, options [nop,nop,TS val 4236803207 ecr 950039097], length 0
2024-11-07 16:42:58.088967 IP 140.82.121.3.443 > 10.32.43.124.59181: Flags [.], ack 3905, win 74, options [nop,nop,TS val 2565261224 ecr 3247038396], length 0
2024-11-07 16:42:58.091123 IP 140.82.121.3.443 > 10.32.43.124.59181: Flags [P.], seq 3494:3573, ack 3905, win 74, options [nop,nop,TS val 2565261226 ecr 3247038396], length 79
2024-11-07 16:42:58.091124 IP 140.82.121.3.443 > 10.32.43.124.59181: Flags [P.], seq 3573:3652, ack 3905, win 74, options [nop,nop,TS val 2565261226 ecr 3247038396], length 79
2024-11-07 16:42:58.091158 IP 10.32.43.124.59181 > 140.82.121.3.443: Flags [.], ack 3652, win 2045, options [nop,nop,TS val 3247038424 ecr 2565261226], length 0
2024-11-07 16:42:58.099315 IP 140.82.121.3.443 > 10.32.43.124.59181: Flags [P.], seq 3652:3716, ack 3905, win 74, options [nop,nop,TS val 2565261235 ecr 3247038396], length 64
2024-11-07 16:42:58.099350 IP 10.32.43.124.59181 > 140.82.121.3.443: Flags [.], ack 3716, win 2047, options [nop,nop,TS val 3247038432 ecr 2565261235], length 0
2024-11-07 16:42:58.099456 IP 10.32.43.124.59181 > 140.82.121.3.443: Flags [P.], seq 3905:3936, ack 3716, win 2048, options [nop,nop,TS val 3247038432 ecr 2565261235], length 31
2024-11-07 16:42:58.117778 IP 10.32.43.124.58932 > 172.65.251.78.443: Flags [.], seq 5667:7055, ack 16948, win 4542, options [nop,nop,TS val 950039143 ecr 4236803207], length 1388
2024-11-07 16:42:58.117806 IP 10.32.43.124.58932 > 172.65.251.78.443: Flags [P.], seq 7055:8118, ack 16948, win 4542, options [nop,nop,TS val 950039143 ecr 4236803207], length 1063
2024-11-07 16:42:58.117824 IP 10.32.43.124.58932 > 172.65.251.78.443: Flags [P.], seq 8118:8537, ack 16948, win 4542, options [nop,nop,TS val 950039143 ecr 4236803207], length 419
2024-11-07 16:42:58.119301 IP 172.65.251.78.443 > 10.32.43.124.58932: Flags [P.], seq 16948:17441, ack 5667, win 9, options [nop,nop,TS val 4236803240 ecr 950039097], length 493
2024-11-07 16:42:58.119363 IP 10.32.43.124.58932 > 172.65.251.78.443: Flags [.], ack 17441, win 4534, options [nop,nop,TS val 950039144 ecr 4236803240], length 0
2024-11-07 16:42:58.119668 IP 10.32.43.124.58932 > 172.65.251.78.443: Flags [P.], seq 8537:8572, ack 17441, win 4542, options [nop,nop,TS val 950039144 ecr 4236803240], length 35
2024-11-07 16:42:58.120348 IP 172.65.251.78.443 > 10.32.43.124.58932: Flags [.], ack 8537, win 9, options [nop,nop,TS val 4236803241 ecr 950039143], length 0
2024-11-07 16:42:58.149904 IP 10.32.43.124.58932 > 172.65.251.78.443: Flags [P.], seq 8537:8572, ack 17441, win 4542, options [nop,nop,TS val 950039175 ecr 4236803241], length 35
2024-11-07 16:42:58.152300 IP 172.65.251.78.443 > 10.32.43.124.58932: Flags [.], ack 8572, win 9, options [nop,nop,TS val 4236803273 ecr 950039175,nop,nop,sack 1 {8537:8572}], length 0
2024-11-07 16:42:58.169360 IP 140.82.121.3.443 > 10.32.43.124.59181: Flags [.], ack 3936, win 74, options [nop,nop,TS val 2565261305 ecr 3247038432], length 0
2024-11-07 16:42:58.174675 IP 10.32.43.124.58932 > 172.65.251.78.443: Flags [.], seq 8572:9960, ack 17441, win 4542, options [nop,nop,TS val 950039200 ecr 4236803273], length 1388
2024-11-07 16:42:58.174699 IP 10.32.43.124.58932 > 172.65.251.78.443: Flags [P.], seq 9960:11023, ack 17441, win 4542, options [nop,nop,TS val 950039200 ecr 4236803273], length 1063
2024-11-07 16:42:58.174714 IP 10.32.43.124.58932 > 172.65.251.78.443: Flags [.], seq 11023:12411, ack 17441, win 4542, options [nop,nop,TS val 950039200 ecr 4236803273], length 1388
2024-11-07 16:42:58.174716 IP 10.32.43.124.58932 > 172.65.251.78.443: Flags [P.], seq 12411:13338, ack 17441, win 4542, options [nop,nop,TS val 950039200 ecr 4236803273], length 927
2024-11-07 16:42:58.177136 IP 172.65.251.78.443 > 10.32.43.124.58932: Flags [.], ack 9960, win 9, options [nop,nop,TS val 4236803298 ecr 950039200], length 0
2024-11-07 16:42:58.177137 IP 172.65.251.78.443 > 10.32.43.124.58932: Flags [.], ack 11023, win 9, options [nop,nop,TS val 4236803298 ecr 950039200], length 0
2024-11-07 16:42:58.177137 IP 172.65.251.78.443 > 10.32.43.124.58932: Flags [.], ack 13338, win 9, options [nop,nop,TS val 4236803298 ecr 950039200], length 0
2024-11-07 16:42:58.180820 IP 10.32.43.124.58932 > 172.65.251.78.443: Flags [.], seq 13338:14726, ack 17441, win 4542, options [nop,nop,TS val 950039206 ecr 4236803298], length 1388
2024-11-07 16:42:58.180850 IP 10.32.43.124.58932 > 172.65.251.78.443: Flags [P.], seq 14726:15789, ack 17441, win 4542, options [nop,nop,TS val 950039206 ecr 4236803298], length 1063
2024-11-07 16:42:58.180868 IP 10.32.43.124.58932 > 172.65.251.78.443: Flags [P.], seq 15789:16149, ack 17441, win 4542, options [nop,nop,TS val 950039206 ecr 4236803298], length 360
2024-11-07 16:42:58.183280 IP 172.65.251.78.443 > 10.32.43.124.58932: Flags [.], ack 14726, win 9, options [nop,nop,TS val 4236803304 ecr 950039206], length 0
2024-11-07 16:42:58.183280 IP 172.65.251.78.443 > 10.32.43.124.58932: Flags [.], ack 15789, win 9, options [nop,nop,TS val 4236803304 ecr 950039206], length 0
2024-11-07 16:42:58.183281 IP 172.65.251.78.443 > 10.32.43.124.58932: Flags [.], ack 16149, win 9, options [nop,nop,TS val 4236803304 ecr 950039206], length 0
2024-11-07 16:42:58.188288 IP 10.32.43.124.58932 > 172.65.251.78.443: Flags [.], seq 16149:17537, ack 17441, win 4542, options [nop,nop,TS val 950039213 ecr 4236803304], length 1388
2024-11-07 16:42:58.188310 IP 10.32.43.124.58932 > 172.65.251.78.443: Flags [P.], seq 17537:18600, ack 17441, win 4542, options [nop,nop,TS val 950039213 ecr 4236803304], length 1063
2024-11-07 16:42:58.188328 IP 10.32.43.124.58932 > 172.65.251.78.443: Flags [.], seq 18600:19988, ack 17441, win 4542, options [nop,nop,TS val 950039213 ecr 4236803304], length 1388
2024-11-07 16:42:58.188331 IP 10.32.43.124.58932 > 172.65.251.78.443: Flags [P.], seq 19988:19990, ack 17441, win 4542, options [nop,nop,TS val 950039213 ecr 4236803304], length 2
2024-11-07 16:42:58.190533 IP 10.32.43.124.58932 > 172.65.251.78.443: Flags [.], seq 19990:21378, ack 17441, win 4542, options [nop,nop,TS val 950039216 ecr 4236803304], length 1388
2024-11-07 16:42:58.190545 IP 10.32.43.124.58932 > 172.65.251.78.443: Flags [P.], seq 21378:22471, ack 17441, win 4542, options [nop,nop,TS val 950039216 ecr 4236803304], length 1093
2024-11-07 16:42:58.190759 IP 172.65.251.78.443 > 10.32.43.124.58932: Flags [.], ack 18600, win 9, options [nop,nop,TS val 4236803311 ecr 950039213], length 0
2024-11-07 16:42:58.190760 IP 172.65.251.78.443 > 10.32.43.124.58932: Flags [.], ack 19990, win 9, options [nop,nop,TS val 4236803311 ecr 950039213], length 0
2024-11-07 16:42:58.191148 IP 10.32.43.124.58932 > 172.65.251.78.443: Flags [.], seq 22471:23859, ack 17441, win 4542, options [nop,nop,TS val 950039216 ecr 4236803311], length 1388
2024-11-07 16:42:58.191164 IP 10.32.43.124.58932 > 172.65.251.78.443: Flags [P.], seq 23859:24937, ack 17441, win 4542, options [nop,nop,TS val 950039216 ecr 4236803311], length 1078
2024-11-07 16:42:58.192962 IP 172.65.251.78.443 > 10.32.43.124.58932: Flags [.], ack 22471, win 9, options [nop,nop,TS val 4236803313 ecr 950039216], length 0
2024-11-07 16:42:58.193606 IP 172.65.251.78.443 > 10.32.43.124.58932: Flags [.], ack 23859, win 9, options [nop,nop,TS val 4236803314 ecr 950039216], length 0
2024-11-07 16:42:58.193606 IP 172.65.251.78.443 > 10.32.43.124.58932: Flags [.], ack 24937, win 9, options [nop,nop,TS val 4236803314 ecr 950039216], length 0
2024-11-07 16:42:58.222504 IP 10.32.43.124.58936 > 172.65.251.78.443: Flags [P.], seq 3794229316:3794229389, ack 2507383471, win 2048, options [nop,nop,TS val 3646228057 ecr 1798405200], length 73
2024-11-07 16:42:58.222538 IP 10.32.43.124.58936 > 172.65.251.78.443: Flags [P.], seq 73:112, ack 1, win 2048, options [nop,nop,TS val 3646228057 ecr 1798405200], length 39
2024-11-07 16:42:58.225341 IP 172.65.251.78.443 > 10.32.43.124.58936: Flags [.], ack 73, win 9, options [nop,nop,TS val 1798462979 ecr 3646228057], length 0
2024-11-07 16:42:58.225342 IP 172.65.251.78.443 > 10.32.43.124.58936: Flags [.], ack 112, win 9, options [nop,nop,TS val 1798462979 ecr 3646228057], length 0
2024-11-07 16:42:58.226110 IP 172.65.251.78.443 > 10.32.43.124.58936: Flags [P.], seq 1:40, ack 112, win 9, options [nop,nop,TS val 1798462980 ecr 3646228057], length 39
2024-11-07 16:42:58.226159 IP 10.32.43.124.58936 > 172.65.251.78.443: Flags [.], ack 40, win 2047, options [nop,nop,TS val 3646228059 ecr 1798462980], length 0
2024-11-07 16:42:58.275920 IP 172.65.251.78.443 > 10.32.43.124.58932: Flags [.], seq 17441:18889, ack 24937, win 9, options [nop,nop,TS val 4236803396 ecr 950039216], length 1448
2024-11-07 16:42:58.275921 IP 172.65.251.78.443 > 10.32.43.124.58932: Flags [P.], seq 18889:19980, ack 24937, win 9, options [nop,nop,TS val 4236803396 ecr 950039216], length 1091
2024-11-07 16:42:58.275995 IP 10.32.43.124.58932 > 172.65.251.78.443: Flags [.], ack 19980, win 4502, options [nop,nop,TS val 950039301 ecr 4236803396], length 0
2024-11-07 16:42:58.330955 IP 172.65.251.78.443 > 10.32.43.124.58932: Flags [.], seq 19980:21428, ack 24937, win 9, options [nop,nop,TS val 4236803451 ecr 950039301], length 1448
2024-11-07 16:42:58.330957 IP 172.65.251.78.443 > 10.32.43.124.58932: Flags [P.], seq 21428:22540, ack 24937, win 9, options [nop,nop,TS val 4236803451 ecr 950039301], length 1112
2024-11-07 16:42:58.330958 IP 172.65.251.78.443 > 10.32.43.124.58932: Flags [P.], seq 22540:22571, ack 24937, win 9, options [nop,nop,TS val 4236803451 ecr 950039301], length 31
2024-11-07 16:42:58.331047 IP 10.32.43.124.58932 > 172.65.251.78.443: Flags [.], ack 22571, win 4501, options [nop,nop,TS val 950039356 ecr 4236803451], length 0
2024-11-07 16:42:58.331273 IP 10.32.43.124 > 1.1.1.1: ICMP echo request, id 59985, seq 0, length 24
2024-11-07 16:42:58.334428 IP 1.1.1.1 > 10.32.43.124: ICMP echo reply, id 59985, seq 0, length 24
2024-11-07 16:42:58.399450 IP 172.65.251.78.443 > 10.32.43.124.58936: Flags [P.], seq 40:575, ack 112, win 9, options [nop,nop,TS val 1798463153 ecr 3646228059], length 535
2024-11-07 16:42:58.399597 IP 10.32.43.124.58936 > 172.65.251.78.443: Flags [.], ack 575, win 2039, options [nop,nop,TS val 3646228234 ecr 1798463153], length 0
2024-11-07 16:42:58.400021 IP 10.32.43.124.58936 > 172.65.251.78.443: Flags [P.], seq 112:147, ack 575, win 2048, options [nop,nop,TS val 3646228234 ecr 1798463153], length 35
2024-11-07 16:42:58.402818 IP 10.32.43.124.58932 > 172.65.251.78.443: Flags [P.], seq 24937:25354, ack 22571, win 4542, options [nop,nop,TS val 950039428 ecr 4236803451], length 417
2024-11-07 16:42:58.405221 IP 172.65.251.78.443 > 10.32.43.124.58932: Flags [.], ack 25354, win 9, options [nop,nop,TS val 4236803526 ecr 950039428], length 0
2024-11-07 16:42:58.421160 IP 172.65.251.78.443 > 10.32.43.124.58932: Flags [P.], seq 22571:22938, ack 25354, win 9, options [nop,nop,TS val 4236803542 ecr 950039428], length 367
2024-11-07 16:42:58.421223 IP 10.32.43.124.58932 > 172.65.251.78.443: Flags [.], ack 22938, win 4536, options [nop,nop,TS val 950039446 ecr 4236803542], length 0
2024-11-07 16:42:58.421433 IP 10.32.43.124.58932 > 172.65.251.78.443: Flags [P.], seq 25354:25389, ack 22938, win 4542, options [nop,nop,TS val 950039446 ecr 4236803542], length 35
2024-11-07 16:42:58.444049 IP 172.65.251.78.443 > 10.32.43.124.58936: Flags [.], ack 147, win 9, options [nop,nop,TS val 1798463198 ecr 3646228234], length 0
2024-11-07 16:42:58.452359 IP 172.65.251.78.443 > 10.32.43.124.58932: Flags [.], seq 22938:24386, ack 25389, win 9, options [nop,nop,TS val 4236803573 ecr 950039446], length 1448
2024-11-07 16:42:58.452361 IP 172.65.251.78.443 > 10.32.43.124.58932: Flags [P.], seq 24386:25301, ack 25389, win 9, options [nop,nop,TS val 4236803573 ecr 950039446], length 915
2024-11-07 16:42:58.452427 IP 10.32.43.124.58932 > 172.65.251.78.443: Flags [.], ack 25301, win 4505, options [nop,nop,TS val 950039477 ecr 4236803573], length 0
2024-11-07 16:42:58.452590 IP 172.65.251.78.443 > 10.32.43.124.58932: Flags [P.], seq 25301:25809, ack 25389, win 9, options [nop,nop,TS val 4236803573 ecr 950039446], length 508
2024-11-07 16:42:58.452622 IP 10.32.43.124.58932 > 172.65.251.78.443: Flags [.], ack 25809, win 4534, options [nop,nop,TS val 950039477 ecr 4236803573], length 0
2024-11-07 16:42:58.465272 IP 10.32.43.124.58932 > 172.65.251.78.443: Flags [.], seq 25389:26777, ack 25809, win 4542, options [nop,nop,TS val 950039490 ecr 4236803573], length 1388
2024-11-07 16:42:58.465293 IP 10.32.43.124.58932 > 172.65.251.78.443: Flags [P.], seq 26777:27622, ack 25809, win 4542, options [nop,nop,TS val 950039490 ecr 4236803573], length 845
2024-11-07 16:42:58.467771 IP 172.65.251.78.443 > 10.32.43.124.58932: Flags [.], ack 27622, win 9, options [nop,nop,TS val 4236803588 ecr 950039490], length 0
2024-11-07 16:42:58.468882 IP 172.65.251.78.443 > 10.32.43.124.58932: Flags [P.], seq 25809:26555, ack 27622, win 9, options [nop,nop,TS val 4236803589 ecr 950039490], length 746
2024-11-07 16:42:58.468915 IP 10.32.43.124.58932 > 172.65.251.78.443: Flags [.], ack 26555, win 4530, options [nop,nop,TS val 950039494 ecr 4236803589], length 0
2024-11-07 16:42:58.469163 IP 10.32.43.124.58932 > 172.65.251.78.443: Flags [P.], seq 27622:27657, ack 26555, win 4542, options [nop,nop,TS val 950039494 ecr 4236803589], length 35
2024-11-07 16:42:58.470201 IP 172.65.251.78.443 > 10.32.43.124.58932: Flags [P.], seq 26555:27205, ack 27622, win 9, options [nop,nop,TS val 4236803591 ecr 950039490], length 650
2024-11-07 16:42:58.470218 IP 10.32.43.124.58932 > 172.65.251.78.443: Flags [.], ack 27205, win 4531, options [nop,nop,TS val 950039495 ecr 4236803591], length 0
2024-11-07 16:42:58.470394 IP 10.32.43.124.58932 > 172.65.251.78.443: Flags [P.], seq 27657:27692, ack 27205, win 4542, options [nop,nop,TS val 950039495 ecr 4236803591], length 35
2024-11-07 16:42:58.472725 IP 172.65.251.78.443 > 10.32.43.124.58932: Flags [.], ack 27692, win 9, options [nop,nop,TS val 4236803593 ecr 950039494], length 0
2024-11-07 16:42:58.578494 IP 172.65.251.78.443 > 10.32.43.124.58932: Flags [.], seq 27205:28653, ack 27692, win 9, options [nop,nop,TS val 4236803699 ecr 950039494], length 1448
2024-11-07 16:42:58.578497 IP 172.65.251.78.443 > 10.32.43.124.58932: Flags [P.], seq 28653:29526, ack 27692, win 9, options [nop,nop,TS val 4236803699 ecr 950039494], length 873
2024-11-07 16:42:58.578498 IP 172.65.251.78.443 > 10.32.43.124.58932: Flags [P.], seq 29526:30223, ack 27692, win 9, options [nop,nop,TS val 4236803699 ecr 950039494], length 697
2024-11-07 16:42:58.578630 IP 10.32.43.124.58932 > 172.65.251.78.443: Flags [.], ack 30223, win 4494, options [nop,nop,TS val 950039604 ecr 4236803699], length 0
2024-11-07 16:42:58.578795 IP 10.32.43.124.58932 > 172.65.251.78.443: Flags [.], ack 30223, win 4542, options [nop,nop,TS val 950039604 ecr 4236803699], length 0
2024-11-07 16:42:58.603181 IP 172.65.251.78.443 > 10.32.43.124.58932: Flags [.], seq 30223:31671, ack 27692, win 9, options [nop,nop,TS val 4236803724 ecr 950039604], length 1448
2024-11-07 16:42:58.603182 IP 172.65.251.78.443 > 10.32.43.124.58932: Flags [P.], seq 31671:31890, ack 27692, win 9, options [nop,nop,TS val 4236803724 ecr 950039604], length 219
2024-11-07 16:42:58.603183 IP 172.65.251.78.443 > 10.32.43.124.58932: Flags [P.], seq 31890:32056, ack 27692, win 9, options [nop,nop,TS val 4236803724 ecr 950039604], length 166
2024-11-07 16:42:58.603229 IP 10.32.43.124.58932 > 172.65.251.78.443: Flags [.], ack 32056, win 4513, options [nop,nop,TS val 950039628 ecr 4236803724], length 0
2024-11-07 16:42:58.603268 IP 172.65.251.78.443 > 10.32.43.124.58932: Flags [P.], seq 32056:32087, ack 27692, win 9, options [nop,nop,TS val 4236803724 ecr 950039604], length 31
2024-11-07 16:42:58.603315 IP 10.32.43.124.58932 > 172.65.251.78.443: Flags [.], ack 32087, win 4541, options [nop,nop,TS val 950039628 ecr 4236803724], length 0
2024-11-07 16:42:58.781818 IP 172.65.251.78.443 > 10.32.43.124.58932: Flags [P.], seq 32087:32894, ack 27692, win 9, options [nop,nop,TS val 4236803902 ecr 950039628], length 807
2024-11-07 16:42:58.781934 IP 10.32.43.124.58932 > 172.65.251.78.443: Flags [.], ack 32894, win 4542, options [nop,nop,TS val 950039807 ecr 4236803902], length 0
2024-11-07 16:42:58.782166 IP 10.32.43.124.58932 > 172.65.251.78.443: Flags [P.], seq 27692:27727, ack 32894, win 4542, options [nop,nop,TS val 950039807 ecr 4236803902], length 35
2024-11-07 16:42:58.788776 IP 140.82.121.3.443 > 10.32.43.124.59181: Flags [.], seq 3716:5140, ack 3936, win 74, options [nop,nop,TS val 2565261924 ecr 3247038432], length 1424
2024-11-07 16:42:58.788777 IP 140.82.121.3.443 > 10.32.43.124.59181: Flags [.], seq 5140:6564, ack 3936, win 74, options [nop,nop,TS val 2565261924 ecr 3247038432], length 1424
2024-11-07 16:42:58.788778 IP 140.82.121.3.443 > 10.32.43.124.59181: Flags [.], seq 6564:7988, ack 3936, win 74, options [nop,nop,TS val 2565261924 ecr 3247038432], length 1424
2024-11-07 16:42:58.788779 IP 140.82.121.3.443 > 10.32.43.124.59181: Flags [.], seq 7988:9412, ack 3936, win 74, options [nop,nop,TS val 2565261924 ecr 3247038432], length 1424
2024-11-07 16:42:58.788780 IP 140.82.121.3.443 > 10.32.43.124.59181: Flags [P.], seq 9412:10110, ack 3936, win 74, options [nop,nop,TS val 2565261924 ecr 3247038432], length 698
2024-11-07 16:42:58.788871 IP 10.32.43.124.59181 > 140.82.121.3.443: Flags [.], ack 10110, win 1948, options [nop,nop,TS val 3247039122 ecr 2565261924], length 0
2024-11-07 16:42:58.788887 IP 140.82.121.3.443 > 10.32.43.124.59181: Flags [.], seq 10110:11534, ack 3936, win 74, options [nop,nop,TS val 2565261924 ecr 3247038432], length 1424
2024-11-07 16:42:58.788888 IP 140.82.121.3.443 > 10.32.43.124.59181: Flags [.], seq 11534:12958, ack 3936, win 74, options [nop,nop,TS val 2565261924 ecr 3247038432], length 1424
2024-11-07 16:42:58.788888 IP 140.82.121.3.443 > 10.32.43.124.59181: Flags [.], seq 12958:14382, ack 3936, win 74, options [nop,nop,TS val 2565261924 ecr 3247038432], length 1424
2024-11-07 16:42:58.788889 IP 140.82.121.3.443 > 10.32.43.124.59181: Flags [.], seq 14382:15806, ack 3936, win 74, options [nop,nop,TS val 2565261924 ecr 3247038432], length 1424
2024-11-07 16:42:58.788892 IP 140.82.121.3.443 > 10.32.43.124.59181: Flags [P.], seq 15806:17101, ack 3936, win 74, options [nop,nop,TS val 2565261924 ecr 3247038432], length 1295
2024-11-07 16:42:58.788913 IP 10.32.43.124.59181 > 140.82.121.3.443: Flags [.], ack 17101, win 1838, options [nop,nop,TS val 3247039122 ecr 2565261924], length 0
2024-11-07 16:42:58.788978 IP 10.32.43.124.59181 > 140.82.121.3.443: Flags [.], ack 17101, win 2048, options [nop,nop,TS val 3247039122 ecr 2565261924], length 0
2024-11-07 16:42:58.814658 IP 140.82.121.3.443 > 10.32.43.124.59181: Flags [.], seq 17101:18525, ack 3936, win 74, options [nop,nop,TS val 2565261950 ecr 3247039122], length 1424
2024-11-07 16:42:58.814660 IP 140.82.121.3.443 > 10.32.43.124.59181: Flags [P.], seq 18525:19949, ack 3936, win 74, options [nop,nop,TS val 2565261950 ecr 3247039122], length 1424
2024-11-07 16:42:58.814661 IP 140.82.121.3.443 > 10.32.43.124.59181: Flags [.], seq 19949:21373, ack 3936, win 74, options [nop,nop,TS val 2565261950 ecr 3247039122], length 1424
2024-11-07 16:42:58.814661 IP 140.82.121.3.443 > 10.32.43.124.59181: Flags [P.], seq 21373:22797, ack 3936, win 74, options [nop,nop,TS val 2565261950 ecr 3247039122], length 1424
2024-11-07 16:42:58.814662 IP 140.82.121.3.443 > 10.32.43.124.59181: Flags [.], seq 22797:24221, ack 3936, win 74, options [nop,nop,TS val 2565261950 ecr 3247039122], length 1424
2024-11-07 16:42:58.814663 IP 140.82.121.3.443 > 10.32.43.124.59181: Flags [P.], seq 24221:25645, ack 3936, win 74, options [nop,nop,TS val 2565261950 ecr 3247039122], length 1424
2024-11-07 16:42:58.814663 IP 140.82.121.3.443 > 10.32.43.124.59181: Flags [.], seq 25645:27069, ack 3936, win 74, options [nop,nop,TS val 2565261950 ecr 3247039122], length 1424
2024-11-07 16:42:58.814664 IP 140.82.121.3.443 > 10.32.43.124.59181: Flags [P.], seq 27069:28493, ack 3936, win 74, options [nop,nop,TS val 2565261950 ecr 3247039122], length 1424
2024-11-07 16:42:58.814665 IP 140.82.121.3.443 > 10.32.43.124.59181: Flags [.], seq 28493:29917, ack 3936, win 74, options [nop,nop,TS val 2565261950 ecr 3247039122], length 1424
2024-11-07 16:42:58.814665 IP 140.82.121.3.443 > 10.32.43.124.59181: Flags [P.], seq 29917:31341, ack 3936, win 74, options [nop,nop,TS val 2565261950 ecr 3247039122], length 1424
2024-11-07 16:42:58.814666 IP 140.82.121.3.443 > 10.32.43.124.59181: Flags [.], seq 31341:32765, ack 3936, win 74, options [nop,nop,TS val 2565261950 ecr 3247039122], length 1424
2024-11-07 16:42:58.814666 IP 140.82.121.3.443 > 10.32.43.124.59181: Flags [P.], seq 32765:34189, ack 3936, win 74, options [nop,nop,TS val 2565261950 ecr 3247039122], length 1424
2024-11-07 16:42:58.814667 IP 140.82.121.3.443 > 10.32.43.124.59181: Flags [.], seq 34189:35613, ack 3936, win 74, options [nop,nop,TS val 2565261950 ecr 3247039122], length 1424
2024-11-07 16:42:58.814667 IP 140.82.121.3.443 > 10.32.43.124.59181: Flags [P.], seq 35613:37037, ack 3936, win 74, options [nop,nop,TS val 2565261950 ecr 3247039122], length 1424
2024-11-07 16:42:58.814760 IP 10.32.43.124.59181 > 140.82.121.3.443: Flags [.], ack 32765, win 1803, options [nop,nop,TS val 3247039148 ecr 2565261950], length 0
2024-11-07 16:42:58.814801 IP 10.32.43.124.59181 > 140.82.121.3.443: Flags [.], ack 37037, win 1736, options [nop,nop,TS val 3247039148 ecr 2565261950], length 0
2024-11-07 16:42:58.814958 IP 10.32.43.124.59181 > 140.82.121.3.443: Flags [.], ack 37037, win 2048, options [nop,nop,TS val 3247039148 ecr 2565261950], length 0
2024-11-07 16:42:58.814960 IP 140.82.121.3.443 > 10.32.43.124.59181: Flags [.], seq 37037:38461, ack 3936, win 74, options [nop,nop,TS val 2565261950 ecr 3247039122], length 1424
2024-11-07 16:42:58.814960 IP 140.82.121.3.443 > 10.32.43.124.59181: Flags [P.], seq 38461:39885, ack 3936, win 74, options [nop,nop,TS val 2565261950 ecr 3247039122], length 1424
2024-11-07 16:42:58.814961 IP 140.82.121.3.443 > 10.32.43.124.59181: Flags [.], seq 39885:41309, ack 3936, win 74, options [nop,nop,TS val 2565261950 ecr 3247039122], length 1424
2024-11-07 16:42:58.814962 IP 140.82.121.3.443 > 10.32.43.124.59181: Flags [P.], seq 41309:42733, ack 3936, win 74, options [nop,nop,TS val 2565261950 ecr 3247039122], length 1424
2024-11-07 16:42:58.814962 IP 140.82.121.3.443 > 10.32.43.124.59181: Flags [.], seq 42733:44157, ack 3936, win 74, options [nop,nop,TS val 2565261950 ecr 3247039122], length 1424
2024-11-07 16:42:58.814992 IP 10.32.43.124.59181 > 140.82.121.3.443: Flags [.], ack 44157, win 1936, options [nop,nop,TS val 3247039148 ecr 2565261950], length 0
2024-11-07 16:42:58.815015 IP 10.32.43.124.59181 > 140.82.121.3.443: Flags [.], ack 44157, win 2048, options [nop,nop,TS val 3247039148 ecr 2565261950], length 0
2024-11-07 16:42:58.815091 IP 140.82.121.3.443 > 10.32.43.124.59181: Flags [P.], seq 44157:45581, ack 3936, win 74, options [nop,nop,TS val 2565261950 ecr 3247039122], length 1424
2024-11-07 16:42:58.815108 IP 10.32.43.124.59181 > 140.82.121.3.443: Flags [.], ack 45581, win 2025, options [nop,nop,TS val 3247039148 ecr 2565261950], length 0
2024-11-07 16:42:58.824351 IP 10.32.43.124.58939 > 185.199.108.133.443: Flags [P.], seq 425182654:425182722, ack 3422640355, win 13994, options [nop,nop,TS val 3986937585 ecr 2636397162], length 68
2024-11-07 16:42:58.824382 IP 10.32.43.124.58939 > 185.199.108.133.443: Flags [P.], seq 68:107, ack 1, win 13994, options [nop,nop,TS val 3986937585 ecr 2636397162], length 39
2024-11-07 16:42:58.824393 IP 10.32.43.124.58939 > 185.199.108.133.443: Flags [P.], seq 107:180, ack 1, win 13994, options [nop,nop,TS val 3986937585 ecr 2636397162], length 73
2024-11-07 16:42:58.825063 IP 172.65.251.78.443 > 10.32.43.124.58932: Flags [.], ack 27727, win 9, options [nop,nop,TS val 4236803946 ecr 950039807], length 0
2024-11-07 16:42:58.827337 IP 185.199.108.133.443 > 10.32.43.124.58939: Flags [.], ack 68, win 396, options [nop,nop,TS val 2636426637 ecr 3986937585], length 0
2024-11-07 16:42:58.827338 IP 185.199.108.133.443 > 10.32.43.124.58939: Flags [.], ack 107, win 396, options [nop,nop,TS val 2636426637 ecr 3986937585], length 0
2024-11-07 16:42:58.827338 IP 185.199.108.133.443 > 10.32.43.124.58939: Flags [.], ack 180, win 396, options [nop,nop,TS val 2636426637 ecr 3986937585], length 0
2024-11-07 16:42:58.827459 IP 185.199.108.133.443 > 10.32.43.124.58939: Flags [P.], seq 1:40, ack 180, win 396, options [nop,nop,TS val 2636426638 ecr 3986937585], length 39
2024-11-07 16:42:58.827496 IP 10.32.43.124.58939 > 185.199.108.133.443: Flags [.], ack 40, win 13993, options [nop,nop,TS val 3986937588 ecr 2636426638], length 0
2024-11-07 16:42:58.828584 IP 185.199.108.133.443 > 10.32.43.124.58939: Flags [P.], seq 40:245, ack 180, win 396, options [nop,nop,TS val 2636426639 ecr 3986937585], length 205
2024-11-07 16:42:58.828604 IP 10.32.43.124.58939 > 185.199.108.133.443: Flags [.], ack 245, win 13990, options [nop,nop,TS val 3986937590 ecr 2636426639], length 0
2024-11-07 16:42:58.828762 IP 185.199.108.133.443 > 10.32.43.124.58939: Flags [P.], seq 245:392, ack 180, win 396, options [nop,nop,TS val 2636426639 ecr 3986937585], length 147
2024-11-07 16:42:58.828777 IP 10.32.43.124.58939 > 185.199.108.133.443: Flags [.], ack 392, win 13991, options [nop,nop,TS val 3986937590 ecr 2636426639], length 0
2024-11-07 16:42:58.840782 IP 140.82.121.3.443 > 10.32.43.124.59181: Flags [.], seq 45581:47005, ack 3936, win 74, options [nop,nop,TS val 2565261976 ecr 3247039148], length 1424
2024-11-07 16:42:58.840783 IP 140.82.121.3.443 > 10.32.43.124.59181: Flags [P.], seq 47005:48429, ack 3936, win 74, options [nop,nop,TS val 2565261976 ecr 3247039148], length 1424
2024-11-07 16:42:58.840783 IP 140.82.121.3.443 > 10.32.43.124.59181: Flags [.], seq 48429:49853, ack 3936, win 74, options [nop,nop,TS val 2565261976 ecr 3247039148], length 1424
2024-11-07 16:42:58.840784 IP 140.82.121.3.443 > 10.32.43.124.59181: Flags [P.], seq 49853:51277, ack 3936, win 74, options [nop,nop,TS val 2565261976 ecr 3247039148], length 1424
2024-11-07 16:42:58.840784 IP 140.82.121.3.443 > 10.32.43.124.59181: Flags [P.], seq 51277:52066, ack 3936, win 74, options [nop,nop,TS val 2565261976 ecr 3247039148], length 789
2024-11-07 16:42:58.840854 IP 10.32.43.124.59181 > 140.82.121.3.443: Flags [.], ack 52066, win 1946, options [nop,nop,TS val 3247039174 ecr 2565261976], length 0
2024-11-07 16:42:58.840921 IP 10.32.43.124.59181 > 140.82.121.3.443: Flags [.], ack 52066, win 2048, options [nop,nop,TS val 3247039174 ecr 2565261976], length 0
2024-11-07 16:42:58.873576 IP 140.82.121.3.443 > 10.32.43.124.59181: Flags [.], seq 52066:53490, ack 3936, win 74, options [nop,nop,TS val 2565262009 ecr 3247039174], length 1424
2024-11-07 16:42:58.873577 IP 140.82.121.3.443 > 10.32.43.124.59181: Flags [.], seq 53490:54914, ack 3936, win 74, options [nop,nop,TS val 2565262009 ecr 3247039174], length 1424
2024-11-07 16:42:58.873578 IP 140.82.121.3.443 > 10.32.43.124.59181: Flags [.], seq 54914:56338, ack 3936, win 74, options [nop,nop,TS val 2565262009 ecr 3247039174], length 1424
2024-11-07 16:42:58.873578 IP 140.82.121.3.443 > 10.32.43.124.59181: Flags [P.], seq 56338:57665, ack 3936, win 74, options [nop,nop,TS val 2565262009 ecr 3247039174], length 1327
2024-11-07 16:42:58.873579 IP 140.82.121.3.443 > 10.32.43.124.59181: Flags [P.], seq 57665:58916, ack 3936, win 74, options [nop,nop,TS val 2565262009 ecr 3247039174], length 1251
2024-11-07 16:42:58.873655 IP 10.32.43.124.59181 > 140.82.121.3.443: Flags [.], ack 58916, win 1940, options [nop,nop,TS val 3247039207 ecr 2565262009], length 0
2024-11-07 16:42:58.873733 IP 10.32.43.124.59181 > 140.82.121.3.443: Flags [.], ack 58916, win 2048, options [nop,nop,TS val 3247039207 ecr 2565262009], length 0
2024-11-07 16:42:58.873876 IP 140.82.121.3.443 > 10.32.43.124.59181: Flags [.], seq 58916:60340, ack 3936, win 74, options [nop,nop,TS val 2565262009 ecr 3247039174], length 1424
2024-11-07 16:42:58.873877 IP 140.82.121.3.443 > 10.32.43.124.59181: Flags [.], seq 60340:61764, ack 3936, win 74, options [nop,nop,TS val 2565262009 ecr 3247039174], length 1424
2024-11-07 16:42:58.873877 IP 140.82.121.3.443 > 10.32.43.124.59181: Flags [.], seq 61764:63188, ack 3936, win 74, options [nop,nop,TS val 2565262009 ecr 3247039174], length 1424
2024-11-07 16:42:58.873878 IP 140.82.121.3.443 > 10.32.43.124.59181: Flags [.], seq 63188:64612, ack 3936, win 74, options [nop,nop,TS val 2565262009 ecr 3247039174], length 1424
2024-11-07 16:42:58.873878 IP 140.82.121.3.443 > 10.32.43.124.59181: Flags [.], seq 64612:66036, ack 3936, win 74, options [nop,nop,TS val 2565262009 ecr 3247039174], length 1424
2024-11-07 16:42:58.873879 IP 140.82.121.3.443 > 10.32.43.124.59181: Flags [P.], seq 66036:67268, ack 3936, win 74, options [nop,nop,TS val 2565262009 ecr 3247039174], length 1232
2024-11-07 16:42:58.873879 IP 140.82.121.3.443 > 10.32.43.124.59181: Flags [.], seq 67268:68660, ack 3936, win 74, options [nop,nop,TS val 2565262009 ecr 3247039174], length 1392
